date,title,news_url,fact_check_url,real_or_fake,claim_id
,What can I do to prevent infection?,https://www.who.int/emergencies/diseases/novel-coronavirus-2019/question-and-answers-hub/q-a-detail/q-a-on-on-covid-19-for-older-people,who.int,real,100210
,What can older people do to prepare for COVID-19 in their community?,https://www.who.int/emergencies/diseases/novel-coronavirus-2019/question-and-answers-hub/q-a-detail/q-a-on-on-covid-19-for-older-people,who.int,real,100211
,How can I keep healthy on a daily basis during the COVID-19 pandemic?,https://www.who.int/emergencies/diseases/novel-coronavirus-2019/question-and-answers-hub/q-a-detail/q-a-on-on-covid-19-for-older-people,who.int,real,100212
,What should I do if I have symptoms of COVID-19?,https://www.who.int/emergencies/diseases/novel-coronavirus-2019/question-and-answers-hub/q-a-detail/q-a-on-on-covid-19-for-older-people,who.int,real,100213
,I have recently lost someone I care about. What advice do you have to help me cope?,https://www.who.int/emergencies/diseases/novel-coronavirus-2019/question-and-answers-hub/q-a-detail/q-a-on-on-covid-19-for-older-people,who.int,real,100214
,Can adolescents catch COVID-19?,https://www.who.int/emergencies/diseases/novel-coronavirus-2019/question-and-answers-hub/q-a-detail/q-a-for-adolescents-and-youth-related-to-covid-19,who.int,real,100215
,Can adolescents spread COVID-19 to other people even if they have mild or no symptoms?,https://www.who.int/emergencies/diseases/novel-coronavirus-2019/question-and-answers-hub/q-a-detail/q-a-for-adolescents-and-youth-related-to-covid-20,who.int,real,100216
,Since there are few known cases of adolescents getting seriously ill with COVID-19 should I go to a health facility if I develop symptoms of the disease?,https://www.who.int/emergencies/diseases/novel-coronavirus-2019/question-and-answers-hub/q-a-detail/q-a-for-adolescents-and-youth-related-to-covid-21,who.int,real,100217
,What should I do if someone in my family gets really ill with COVID-19?,https://www.who.int/emergencies/diseases/novel-coronavirus-2019/question-and-answers-hub/q-a-detail/q-a-for-adolescents-and-youth-related-to-covid-22,who.int,real,100218
,I am on medication for a chronic health condition. Should I change anything?,https://www.who.int/emergencies/diseases/novel-coronavirus-2019/question-and-answers-hub/q-a-detail/q-a-for-adolescents-and-youth-related-to-covid-23,who.int,real,100219
,I was due to get vaccinated for HPV meningitis or tetanus but immunization services have been disrupted. Should I be concerned?,https://www.who.int/emergencies/diseases/novel-coronavirus-2019/question-and-answers-hub/q-a-detail/q-a-for-adolescents-and-youth-related-to-covid-24,who.int,real,100220
,I am bored staying home. Since I am very unlikely to get severely ill even if I was to get COVID-19 why is it important that I follow the guidelines to prevent transmission such as keeping physical distance from other people?,https://www.who.int/emergencies/diseases/novel-coronavirus-2019/question-and-answers-hub/q-a-detail/q-a-for-adolescents-and-youth-related-to-covid-25,who.int,real,100221
,Some of my friends are not sticking to the rules about physical distancing. What should I do?,https://www.who.int/emergencies/diseases/novel-coronavirus-2019/question-and-answers-hub/q-a-detail/q-a-for-adolescents-and-youth-related-to-covid-26,who.int,real,100222
,I am feeling really anxious about COVID-19 and its impact on my life. What should I do?,https://www.who.int/emergencies/diseases/novel-coronavirus-2019/question-and-answers-hub/q-a-detail/q-a-for-adolescents-and-youth-related-to-covid-27,who.int,real,100223
,When will this pandemic end so I can go back to school and meet up with my friends?,https://www.who.int/emergencies/diseases/novel-coronavirus-2019/question-and-answers-hub/q-a-detail/q-a-for-adolescents-and-youth-related-to-covid-28,who.int,real,100224
,Schools are reopening in some areas of my country. Is it safe to go back to school?,https://www.who.int/emergencies/diseases/novel-coronavirus-2019/question-and-answers-hub/q-a-detail/q-a-for-adolescents-and-youth-related-to-covid-29,who.int,real,100225
,I know there is a risk of getting COVID-19 at the moment but I feel fine. Can I still play sports?,https://www.who.int/emergencies/diseases/novel-coronavirus-2019/question-and-answers-hub/q-a-detail/q-a-for-adolescents-and-youth-related-to-covid-30,who.int,real,100226
,I am missing out on my education because of the COVID-19 pandemic. What should I do?,https://www.who.int/emergencies/diseases/novel-coronavirus-2019/question-and-answers-hub/q-a-detail/q-a-for-adolescents-and-youth-related-to-covid-31,who.int,real,100227
,COVID-19 is everywhere in the news and I am finding it difficult to know what is true and what is false. What should I do?,https://www.who.int/emergencies/diseases/novel-coronavirus-2019/question-and-answers-hub/q-a-detail/q-a-for-adolescents-and-youth-related-to-covid-32,who.int,real,100228
,Is it safe to have sex at this time?,https://www.who.int/emergencies/diseases/novel-coronavirus-2019/question-and-answers-hub/q-a-detail/q-a-for-adolescents-and-youth-related-to-covid-33,who.int,real,100229
,In the lockdown I am spending much more time online playing games socialising and studying. Should I be worried about this?,https://www.who.int/emergencies/diseases/novel-coronavirus-2019/question-and-answers-hub/q-a-detail/q-a-for-adolescents-and-youth-related-to-covid-34,who.int,real,100230
,I heard I can be hurt by online contacts. What are my risks and how I can protect myself online.,https://www.who.int/emergencies/diseases/novel-coronavirus-2019/question-and-answers-hub/q-a-detail/q-a-for-adolescents-and-youth-related-to-covid-35,who.int,real,100231
,Since my parents stopped going out to work they have been arguing with each other much more and in some instances I have seen one parent harm or hurt the other either verbally or physically. I don’t feel safe at home. What should I do?,https://www.who.int/emergencies/diseases/novel-coronavirus-2019/question-and-answers-hub/q-a-detail/q-a-for-adolescents-and-youth-related-to-covid-36,who.int,real,100232
,I don’t like the way someone touches me at home and we are both at home all the time because of the pandemic. What should I do?,https://www.who.int/emergencies/diseases/novel-coronavirus-2019/question-and-answers-hub/q-a-detail/q-a-for-adolescents-and-youth-related-to-covid-37,who.int,real,100233
,Can COVID-19 be passed through breastfeeding?,https://www.who.int/emergencies/diseases/novel-coronavirus-2019/question-and-answers-hub/q-a-detail/q-a-on-covid-19-and-breastfeeding,who.int,real,100234
,In communities where COVID-19 is prevalent should mothers breastfeed?,https://www.who.int/emergencies/diseases/novel-coronavirus-2019/question-and-answers-hub/q-a-detail/q-a-on-covid-19-and-breastfeeding,who.int,real,100235
,Following delivery should a baby still be immediately placed skin-to-skin and breastfed if the mother is confirmed or suspected to have COVID-19?,https://www.who.int/emergencies/diseases/novel-coronavirus-2019/question-and-answers-hub/q-a-detail/q-a-on-covid-19-and-breastfeeding,who.int,real,100236
,Can women with confirmed or suspected COVID-19 breastfeed?,https://www.who.int/emergencies/diseases/novel-coronavirus-2019/question-and-answers-hub/q-a-detail/q-a-on-covid-19-and-breastfeeding,who.int,real,100237
,If a mother confirmed or suspected to have COVID-19 does not have a medical face mask should she still breastfeed?,https://www.who.int/emergencies/diseases/novel-coronavirus-2019/question-and-answers-hub/q-a-detail/q-a-on-covid-19-and-breastfeeding,who.int,real,100238
,I have confirmed or suspected COVID-19 and am too unwell to breastfeed my baby directly. What can I do?,https://www.who.int/emergencies/diseases/novel-coronavirus-2019/question-and-answers-hub/q-a-detail/q-a-on-covid-19-and-breastfeeding,who.int,real,100239
,I had confirmed or suspected COVID-19 and was unable to breastfeed when can I start to breastfeed again?,https://www.who.int/emergencies/diseases/novel-coronavirus-2019/question-and-answers-hub/q-a-detail/q-a-on-covid-19-and-breastfeeding,who.int,real,100240
,I have confirmed or suspected COVID-19 is it safer to give my baby infant formula milk?,https://www.who.int/emergencies/diseases/novel-coronavirus-2019/question-and-answers-hub/q-a-detail/q-a-on-covid-19-and-breastfeeding,who.int,real,100241
,Why are self-care interventions important during a pandemic like COVID-19?,https://www.who.int/emergencies/diseases/novel-coronavirus-2019/question-and-answers-hub/q-a-detail/q-a-on-self-care-interventions-for-sexual-and-reproductive-health-and-rights-and-covid-19,who.int,real,100242
,Do I need to see a health worker for self care actions?,https://www.who.int/emergencies/diseases/novel-coronavirus-2019/question-and-answers-hub/q-a-detail/q-a-on-self-care-interventions-for-sexual-and-reproductive-health-and-rights-and-covid-20,who.int,real,100243
,What self care actions can I take to protect my sexual and reproductive health?,https://www.who.int/emergencies/diseases/novel-coronavirus-2019/question-and-answers-hub/q-a-detail/q-a-on-self-care-interventions-for-sexual-and-reproductive-health-and-rights-and-covid-21,who.int,real,100244
,How can I get healthcare support during the COVID-19 pandemic for a self-care intervention?,https://www.who.int/emergencies/diseases/novel-coronavirus-2019/question-and-answers-hub/q-a-detail/q-a-on-self-care-interventions-for-sexual-and-reproductive-health-and-rights-and-covid-22,who.int,real,100245
,How should imported foods from countries with high prevalence of COVID-19 be treated?,https://www.who.int/emergencies/diseases/novel-coronavirus-2019/question-and-answers-hub/q-a-detail/questions-relating-to-food-safety-authorities,who.int,real,100246
,Do food inspectors need to wear any protective equipment?,https://www.who.int/emergencies/diseases/novel-coronavirus-2019/question-and-answers-hub/q-a-detail/questions-relating-to-food-safety-authorities,who.int,real,100247
,What do food inspectors need to consider when reopening a food business when the pandemic is over?,https://www.who.int/emergencies/diseases/novel-coronavirus-2019/question-and-answers-hub/q-a-detail/questions-relating-to-food-safety-authorities,who.int,real,100248
,What are the lab protocols for identifying the virus in food? On surfaces?,https://www.who.int/emergencies/diseases/novel-coronavirus-2019/question-and-answers-hub/q-a-detail/questions-relating-to-food-safety-authorities,who.int,real,100249
,Is quarantine necessary for live animals imported from countries experiencing a large numbers of COVID-19 cases?,https://www.who.int/emergencies/diseases/novel-coronavirus-2019/question-and-answers-hub/q-a-detail/questions-relating-to-food-safety-authorities,who.int,real,100250
,How do we ensure the food supply chain remains intact to prevent food shortages?,https://www.who.int/emergencies/diseases/novel-coronavirus-2019/question-and-answers-hub/q-a-detail/questions-relating-to-food-safety-authorities,who.int,real,100251
,How can food businesses remain safe from virus contamination?,https://www.who.int/emergencies/diseases/novel-coronavirus-2019/question-and-answers-hub/q-a-detail/questions-relating-to-food-businesses,who.int,real,100252
,Should grocery store workers wear gloves? Masks?,https://www.who.int/emergencies/diseases/novel-coronavirus-2019/question-and-answers-hub/q-a-detail/questions-relating-to-food-businesses,who.int,real,100253
,What is the protocol when an employee working in a food business becomes ill with COVID-19?,https://www.who.int/emergencies/diseases/novel-coronavirus-2019/question-and-answers-hub/q-a-detail/questions-relating-to-food-businesses,who.int,real,100254
,When can an employee return to work following illness? Are temperature checks appropriate?,https://www.who.int/emergencies/diseases/novel-coronavirus-2019/question-and-answers-hub/q-a-detail/questions-relating-to-food-businesses,who.int,real,100255
,What specific precautions do food workers need to take?,https://www.who.int/emergencies/diseases/novel-coronavirus-2019/question-and-answers-hub/q-a-detail/questions-relating-to-food-businesses,who.int,real,100256
,How should employees maintain safe distance from one another during food production and processing?,https://www.who.int/emergencies/diseases/novel-coronavirus-2019/question-and-answers-hub/q-a-detail/questions-relating-to-food-businesses,who.int,real,100257
,How should baked goods and fresh produce be displayed in a food market/grocery store?,https://www.who.int/emergencies/diseases/novel-coronavirus-2019/question-and-answers-hub/q-a-detail/questions-relating-to-food-businesses,who.int,real,100258
,How should shopping trolleys or carts be disinfected?,https://www.who.int/emergencies/diseases/novel-coronavirus-2019/question-and-answers-hub/q-a-detail/questions-relating-to-food-businesses,who.int,real,100259
,What is the most appropriate sanitizer to use on surfaces in a food production environment?,https://www.who.int/emergencies/diseases/novel-coronavirus-2019/question-and-answers-hub/q-a-detail/questions-relating-to-food-businesses,who.int,real,100260
,Could the virus be transmitted from humans to food animals or vice versa?,https://www.who.int/emergencies/diseases/novel-coronavirus-2019/question-and-answers-hub/q-a-detail/questions-relating-to-food-businesses,who.int,real,100261
,What is known about various conditions affecting survivability of the virus?,https://www.who.int/emergencies/diseases/novel-coronavirus-2019/question-and-answers-hub/q-a-detail/questions-relating-to-food-businesses,who.int,real,100262
,What measures should be taken to ensure safe transport of food during this pandemic?,https://www.who.int/emergencies/diseases/novel-coronavirus-2019/question-and-answers-hub/q-a-detail/questions-relating-to-food-businesses,who.int,real,100263
,What measures should be taken to ensure safe water is used in food production during this pandemic?,https://www.who.int/emergencies/diseases/novel-coronavirus-2019/question-and-answers-hub/q-a-detail/questions-relating-to-food-businesses,who.int,real,100264
,How should food premises be cleaned/disinfected during this pandemic?,https://www.who.int/emergencies/diseases/novel-coronavirus-2019/question-and-answers-hub/q-a-detail/questions-relating-to-food-businesses,who.int,real,100265
,Can I get COVID-19 from food?,https://www.who.int/emergencies/diseases/novel-coronavirus-2019/question-and-answers-hub/q-a-detail/questions-relating-to-consumers,who.int,real,100266
,Can the virus live on the surface of foods (including fruits and vegetables frozen foods pre-packaged foods)?,https://www.who.int/emergencies/diseases/novel-coronavirus-2019/question-and-answers-hub/q-a-detail/questions-relating-to-consumers,who.int,real,100267
,How to wash fruits and vegetables? Just with water or something else?,https://www.who.int/emergencies/diseases/novel-coronavirus-2019/question-and-answers-hub/q-a-detail/questions-relating-to-consumers,who.int,real,100268
,Can the virus live on the surface of food packaging? How long? Is it necessary to disinfect?,https://www.who.int/emergencies/diseases/novel-coronavirus-2019/question-and-answers-hub/q-a-detail/questions-relating-to-consumers,who.int,real,100269
,How long is it to cook food? To what temperature to kill the virus?,https://www.who.int/emergencies/diseases/novel-coronavirus-2019/question-and-answers-hub/q-a-detail/questions-relating-to-consumers,who.int,real,100270
,What precautions should consumers take in grocery stores?,https://www.who.int/emergencies/diseases/novel-coronavirus-2019/question-and-answers-hub/q-a-detail/questions-relating-to-consumers,who.int,real,100271
,Is food/grocery delivery safe?,https://www.who.int/emergencies/diseases/novel-coronavirus-2019/question-and-answers-hub/q-a-detail/questions-relating-to-consumers,who.int,real,100272
,What is the best household disinfectant for surfaces?,https://www.who.int/emergencies/diseases/novel-coronavirus-2019/question-and-answers-hub/q-a-detail/questions-relating-to-consumers,who.int,real,100273
,Is it still safe to go to food markets? Animal markets? Wet markets?,https://www.who.int/emergencies/diseases/novel-coronavirus-2019/question-and-answers-hub/q-a-detail/questions-relating-to-consumers,who.int,real,100274
,As a smoker is my risk of getting the COVID-19 virus higher than that of a non-smoker?,https://www.who.int/emergencies/diseases/novel-coronavirus-2019/question-and-answers-hub/q-a-detail/q-a-on-tobacco-and-covid-19,who.int,real,100275
,As a smoker am I likely to get more severe symptoms if infected?,https://www.who.int/emergencies/diseases/novel-coronavirus-2019/question-and-answers-hub/q-a-detail/q-a-on-tobacco-and-covid-20,who.int,real,100276
,As a vaper am I more likely to be infected or to have more severe symptoms if infected?,https://www.who.int/emergencies/diseases/novel-coronavirus-2019/question-and-answers-hub/q-a-detail/q-a-on-tobacco-and-covid-21,who.int,real,100277
,What about using smokeless tobacco like chewing tobacco?,https://www.who.int/emergencies/diseases/novel-coronavirus-2019/question-and-answers-hub/q-a-detail/q-a-on-tobacco-and-covid-22,who.int,real,100278
,What does WHO recommend for tobacco users?,https://www.who.int/emergencies/diseases/novel-coronavirus-2019/question-and-answers-hub/q-a-detail/q-a-on-tobacco-and-covid-23,who.int,real,100279
,What can I do to protect people from the risks associated with smoking smokeless tobacco use and vaping?,https://www.who.int/emergencies/diseases/novel-coronavirus-2019/question-and-answers-hub/q-a-detail/q-a-on-tobacco-and-covid-24,who.int,real,100280
,Does nicotine use affect my chances in the context of COVID-19?,https://www.who.int/emergencies/diseases/novel-coronavirus-2019/question-and-answers-hub/q-a-detail/q-a-on-tobacco-and-covid-25,who.int,real,100281
,Can COVID-19 be transmitted at the workplace?,https://www.who.int/emergencies/diseases/novel-coronavirus-2019/question-and-answers-hub/q-a-detail/q-a-tips-for-health-and-safety-at-the-workplace-in-the-context-of-covid-19,who.int,real,100282
,What is the risk of contracting COVID-19 in the workplace?,https://www.who.int/emergencies/diseases/novel-coronavirus-2019/question-and-answers-hub/q-a-detail/q-a-tips-for-health-and-safety-at-the-workplace-in-the-context-of-covid-20,who.int,real,100283
,How can people assess the risk for exposure to COVID-19 in their workplace and plan for preventive measures?,https://www.who.int/emergencies/diseases/novel-coronavirus-2019/question-and-answers-hub/q-a-detail/q-a-tips-for-health-and-safety-at-the-workplace-in-the-context-of-covid-21,who.int,real,100284
,Who should carry out the workplace risk assessment?,https://www.who.int/emergencies/diseases/novel-coronavirus-2019/question-and-answers-hub/q-a-detail/q-a-tips-for-health-and-safety-at-the-workplace-in-the-context-of-covid-22,who.int,real,100285
,What are the key considerations for the workplace risk assessment?,https://www.who.int/emergencies/diseases/novel-coronavirus-2019/question-and-answers-hub/q-a-detail/q-a-tips-for-health-and-safety-at-the-workplace-in-the-context-of-covid-23,who.int,real,100286
,How should employers decide when to open close or re-open workplaces and/or suspend or downscale work activities?,https://www.who.int/emergencies/diseases/novel-coronavirus-2019/question-and-answers-hub/q-a-detail/q-a-tips-for-health-and-safety-at-the-workplace-in-the-context-of-covid-24,who.int,real,100287
,What key measures to protect against COVID-19 should be undertaken in ALL workplaces?,https://www.who.int/emergencies/diseases/novel-coronavirus-2019/question-and-answers-hub/q-a-detail/q-a-tips-for-health-and-safety-at-the-workplace-in-the-context-of-covid-25,who.int,real,100288
,What additional measures should be taken at workplaces and for jobs at medium risk?,https://www.who.int/emergencies/diseases/novel-coronavirus-2019/question-and-answers-hub/q-a-detail/q-a-tips-for-health-and-safety-at-the-workplace-in-the-context-of-covid-26,who.int,real,100289
,What additional measures should be taken at workplaces and for jobs at high risk?,https://www.who.int/emergencies/diseases/novel-coronavirus-2019/question-and-answers-hub/q-a-detail/q-a-tips-for-health-and-safety-at-the-workplace-in-the-context-of-covid-27,who.int,real,100290
,What should be taken into consideration when setting a physical distance at the workplace?,https://www.who.int/emergencies/diseases/novel-coronavirus-2019/question-and-answers-hub/q-a-detail/q-a-tips-for-health-and-safety-at-the-workplace-in-the-context-of-covid-28,who.int,real,100291
,What are the rights duties and responsibilities of employers?,https://www.who.int/emergencies/diseases/novel-coronavirus-2019/question-and-answers-hub/q-a-detail/q-a-tips-for-health-and-safety-at-the-workplace-in-the-context-of-covid-29,who.int,real,100292
,What are the rights duties and responsibilities of workers?,https://www.who.int/emergencies/diseases/novel-coronavirus-2019/question-and-answers-hub/q-a-detail/q-a-tips-for-health-and-safety-at-the-workplace-in-the-context-of-covid-30,who.int,real,100293
,How can workplaces plan for the prevention and mitigation of COVID-19?,https://www.who.int/emergencies/diseases/novel-coronavirus-2019/question-and-answers-hub/q-a-detail/q-a-tips-for-health-and-safety-at-the-workplace-in-the-context-of-covid-31,who.int,real,100294
,Can the return to the workplace be immediate after public measures are lifted?,https://www.who.int/emergencies/diseases/novel-coronavirus-2019/question-and-answers-hub/q-a-detail/q-a-tips-for-health-and-safety-at-the-workplace-in-the-context-of-covid-32,who.int,real,100295
,Does WHO recommend thermal testing of people entering a workplace?,https://www.who.int/emergencies/diseases/novel-coronavirus-2019/question-and-answers-hub/q-a-detail/q-a-tips-for-health-and-safety-at-the-workplace-in-the-context-of-covid-33,who.int,real,100296
,Does WHO recommend workers wear masks at the workplace (office or others)? If yes what type of masks?,https://www.who.int/emergencies/diseases/novel-coronavirus-2019/question-and-answers-hub/q-a-detail/q-a-tips-for-health-and-safety-at-the-workplace-in-the-context-of-covid-34,who.int,real,100297
,Are there any directives on office ventilation and air conditioning use?,https://www.who.int/emergencies/diseases/novel-coronavirus-2019/question-and-answers-hub/q-a-detail/q-a-tips-for-health-and-safety-at-the-workplace-in-the-context-of-covid-35,who.int,real,100298
,What mental health and psychosocial support should be provided to workers during COVID-19?,https://www.who.int/emergencies/diseases/novel-coronavirus-2019/question-and-answers-hub/q-a-detail/q-a-tips-for-health-and-safety-at-the-workplace-in-the-context-of-covid-36,who.int,real,100299
,What is dexamethasone and does it work against COVID-19?,https://www.who.int/emergencies/diseases/novel-coronavirus-2019/question-and-answers-hub/q-a-detail/q-a-dexamethasone-and-covid-19,who.int,real,100300
,Were all patients in RECOVERY given dexamethasone?,https://www.who.int/emergencies/diseases/novel-coronavirus-2019/question-and-answers-hub/q-a-detail/q-a-dexamethasone-and-covid-20,who.int,real,100301
,Does WHO recommend the use of dexamethasone for COVID-19 patients?,https://www.who.int/emergencies/diseases/novel-coronavirus-2019/question-and-answers-hub/q-a-detail/q-a-dexamethasone-and-covid-21,who.int,real,100302
,Is dexamethasone on the WHO Essential Medicines List?,https://www.who.int/emergencies/diseases/novel-coronavirus-2019/question-and-answers-hub/q-a-detail/q-a-dexamethasone-and-covid-22,who.int,real,100303
,Is dexamethasone prequalified by WHO?,https://www.who.int/emergencies/diseases/novel-coronavirus-2019/question-and-answers-hub/q-a-detail/q-a-dexamethasone-and-covid-23,who.int,real,100304
,What dose was used in the Recovery trial?,https://www.who.int/emergencies/diseases/novel-coronavirus-2019/question-and-answers-hub/q-a-detail/q-a-dexamethasone-and-covid-24,who.int,real,100305
,What are the typical side effects of dexamethasone?,https://www.who.int/emergencies/diseases/novel-coronavirus-2019/question-and-answers-hub/q-a-detail/q-a-dexamethasone-and-covid-25,who.int,real,100306
,How do the doses used in the RECOVERY trial compare with those used normally?,https://www.who.int/emergencies/diseases/novel-coronavirus-2019/question-and-answers-hub/q-a-detail/q-a-dexamethasone-and-covid-26,who.int,real,100307
,Can steroids be used in the elderly/children/pregnancy?,https://www.who.int/emergencies/diseases/novel-coronavirus-2019/question-and-answers-hub/q-a-detail/q-a-dexamethasone-and-covid-27,who.int,real,100308
,Is dexamethasone available across the world?,https://www.who.int/emergencies/diseases/novel-coronavirus-2019/question-and-answers-hub/q-a-detail/q-a-dexamethasone-and-covid-28,who.int,real,100309
,How many API suppliers are there?,https://www.who.int/emergencies/diseases/novel-coronavirus-2019/question-and-answers-hub/q-a-detail/q-a-dexamethasone-and-covid-29,who.int,real,100310
,Is dexamethasone affordable/what is the price per treatment?,https://www.who.int/emergencies/diseases/novel-coronavirus-2019/question-and-answers-hub/q-a-detail/q-a-dexamethasone-and-covid-30,who.int,real,100311
,Why was the use of hydroxychloroquine stopped in the Solidarity Trial?,https://www.who.int/emergencies/diseases/novel-coronavirus-2019/question-and-answers-hub/q-a-detail/q-a-hydroxychloroquine-and-covid-19,who.int,real,100312
,What will happen to the people who were already enrolled in the hydroxychloroquine arm of the trial?,https://www.who.int/emergencies/diseases/novel-coronavirus-2019/question-and-answers-hub/q-a-detail/q-a-hydroxychloroquine-and-covid-20,who.int,real,100313
