date,title,news_url,fact_check_url,real_or_fake,claim_id
,Should children wear a mask?,https://www.who.int/emergencies/diseases/novel-coronavirus-2019/question-and-answers-hub/q-a-detail/q-a-children-and-masks-related-to-covid-19,who.int,real,100338
,Are there situations where children aged 5 years and under may wear or be required to wear a mask?,https://www.who.int/emergencies/diseases/novel-coronavirus-2019/question-and-answers-hub/q-a-detail/q-a-children-and-masks-related-to-covid-20,who.int,real,100339
,Should children with developmental disabilities wear masks?,https://www.who.int/emergencies/diseases/novel-coronavirus-2019/question-and-answers-hub/q-a-detail/q-a-children-and-masks-related-to-covid-21,who.int,real,100340
,Should children who have health issues or a medical condition that compromises their immune system wear a mask?,https://www.who.int/emergencies/diseases/novel-coronavirus-2019/question-and-answers-hub/q-a-detail/q-a-children-and-masks-related-to-covid-22,who.int,real,100341
,What type of mask should children wear?,https://www.who.int/emergencies/diseases/novel-coronavirus-2019/question-and-answers-hub/q-a-detail/q-a-children-and-masks-related-to-covid-23,who.int,real,100342
,How should children wear a mask?,https://www.who.int/emergencies/diseases/novel-coronavirus-2019/question-and-answers-hub/q-a-detail/q-a-children-and-masks-related-to-covid-24,who.int,real,100343
,Should a child wear a mask at home?,https://www.who.int/emergencies/diseases/novel-coronavirus-2019/question-and-answers-hub/q-a-detail/q-a-children-and-masks-related-to-covid-25,who.int,real,100344
,Should teachers or other adults working with children wear a mask?,https://www.who.int/emergencies/diseases/novel-coronavirus-2019/question-and-answers-hub/q-a-detail/q-a-children-and-masks-related-to-covid-26,who.int,real,100345
,Should children wear a mask when playing sports or doing physical activities?,https://www.who.int/emergencies/diseases/novel-coronavirus-2019/question-and-answers-hub/q-a-detail/q-a-children-and-masks-related-to-covid-27,who.int,real,100346
,Are there alternatives to fabric masks such as face shields?,https://www.who.int/emergencies/diseases/novel-coronavirus-2019/question-and-answers-hub/q-a-detail/q-a-children-and-masks-related-to-covid-28,who.int,real,100347
,What is contact tracing?,https://www.who.int/emergencies/diseases/novel-coronavirus-2019/question-and-answers-hub/q-a-detail/coronavirus-disease-covid-19-contact-tracing,who.int,real,100348
,How does contact tracing work?,https://www.who.int/emergencies/diseases/novel-coronavirus-2019/question-and-answers-hub/q-a-detail/coronavirus-disease-covid-19-contact-tracing,who.int,real,100349
,Who is defined as a contact?,https://www.who.int/emergencies/diseases/novel-coronavirus-2019/question-and-answers-hub/q-a-detail/coronavirus-disease-covid-19-contact-tracing,who.int,real,100350
,Can contact tracing help in controlling spread of the virus?,https://www.who.int/emergencies/diseases/novel-coronavirus-2019/question-and-answers-hub/q-a-detail/coronavirus-disease-covid-19-contact-tracing,who.int,real,100351
,When should contact tracing be implemented?,https://www.who.int/emergencies/diseases/novel-coronavirus-2019/question-and-answers-hub/q-a-detail/coronavirus-disease-covid-19-contact-tracing,who.int,real,100352
,What happens if you are a contact?,https://www.who.int/emergencies/diseases/novel-coronavirus-2019/question-and-answers-hub/q-a-detail/coronavirus-disease-covid-19-contact-tracing,who.int,real,100353
,Who is needed for successful contact tracing?,https://www.who.int/emergencies/diseases/novel-coronavirus-2019/question-and-answers-hub/q-a-detail/coronavirus-disease-covid-19-contact-tracing,who.int,real,100354
,What are the tools used for contact tracing?,https://www.who.int/emergencies/diseases/novel-coronavirus-2019/question-and-answers-hub/q-a-detail/coronavirus-disease-covid-19-contact-tracing,who.int,real,100355
,What should be considered for data protection?,https://www.who.int/emergencies/diseases/novel-coronavirus-2019/question-and-answers-hub/q-a-detail/coronavirus-disease-covid-19-contact-tracing,who.int,real,100356
,"Can I get COVID-19 from eating fresh foods, like fruits and vegetables?",https://www.who.int/emergencies/diseases/novel-coronavirus-2019/question-and-answers-hub/q-a-detail/coronavirus-disease-covid-19-food-safety-and-nutrition,who.int,real,100357
,How should I wash fruits and vegetables in the time of COVID-19?,https://www.who.int/emergencies/diseases/novel-coronavirus-2019/question-and-answers-hub/q-a-detail/coronavirus-disease-covid-19-food-safety-and-nutrition,who.int,real,100358
,Can the virus that causes COVID-19 live on the surface of food packaging?,https://www.who.int/emergencies/diseases/novel-coronavirus-2019/question-and-answers-hub/q-a-detail/coronavirus-disease-covid-19-food-safety-and-nutrition,who.int,real,100359
,"Can the virus that causes COVID-19 be transmitted through the consumption of cooked foods, including animal products?",https://www.who.int/emergencies/diseases/novel-coronavirus-2019/question-and-answers-hub/q-a-detail/coronavirus-disease-covid-19-food-safety-and-nutrition,who.int,real,100360
,Is it safe to go to grocery stores and other food markets?,https://www.who.int/emergencies/diseases/novel-coronavirus-2019/question-and-answers-hub/q-a-detail/coronavirus-disease-covid-19-food-safety-and-nutrition,who.int,real,100361
,Is it safe to have groceries delivered?,https://www.who.int/emergencies/diseases/novel-coronavirus-2019/question-and-answers-hub/q-a-detail/coronavirus-disease-covid-19-food-safety-and-nutrition,who.int,real,100362
,What is the best household disinfectant for surfaces?,https://www.who.int/emergencies/diseases/novel-coronavirus-2019/question-and-answers-hub/q-a-detail/coronavirus-disease-covid-19-food-safety-and-nutrition,who.int,real,100363
,What foods should be consumed to support the immune system?,https://www.who.int/emergencies/diseases/novel-coronavirus-2019/question-and-answers-hub/q-a-detail/coronavirus-disease-covid-19-food-safety-and-nutrition,who.int,real,100364
,Can micronutrient (vitamin and mineral) supplements prevent COVID-19 in healthy individuals or cure it in those with COVID-19 disease?,https://www.who.int/emergencies/diseases/novel-coronavirus-2019/question-and-answers-hub/q-a-detail/coronavirus-disease-covid-19-food-safety-and-nutrition,who.int,real,100365
,Are vitamin D supplements needed if individuals are not exposed to sunlight due to lockdowns?,https://www.who.int/emergencies/diseases/novel-coronavirus-2019/question-and-answers-hub/q-a-detail/coronavirus-disease-covid-19-food-safety-and-nutrition,who.int,real,100366
,Are there any herbal teas or herbal supplements that may help prevent or cure COVID-19?,https://www.who.int/emergencies/diseases/novel-coronavirus-2019/question-and-answers-hub/q-a-detail/coronavirus-disease-covid-19-food-safety-and-nutrition,who.int,real,100367
,Can probiotics help prevent COVID-19?,https://www.who.int/emergencies/diseases/novel-coronavirus-2019/question-and-answers-hub/q-a-detail/coronavirus-disease-covid-19-food-safety-and-nutrition,who.int,real,100368
,Can eating ginger help prevent COVID-19?,https://www.who.int/emergencies/diseases/novel-coronavirus-2019/question-and-answers-hub/q-a-detail/coronavirus-disease-covid-19-food-safety-and-nutrition,who.int,real,100369
,Can eating garlic help prevent COVID-19?,https://www.who.int/emergencies/diseases/novel-coronavirus-2019/question-and-answers-hub/q-a-detail/coronavirus-disease-covid-19-food-safety-and-nutrition,who.int,real,100370
,Can adding pepper to your soup or other meals help prevent or cure COVID-19?,https://www.who.int/emergencies/diseases/novel-coronavirus-2019/question-and-answers-hub/q-a-detail/coronavirus-disease-covid-19-food-safety-and-nutrition,who.int,real,100371
,Can I get COVID-19 from food?,https://www.who.int/emergencies/diseases/novel-coronavirus-2019/question-and-answers-hub/q-a-detail/coronavirus-disease-covid-19-food-safety-for-consumers,who.int,real,100372
,"Can the virus live on the surface of foods (including fruits and vegetables, frozen foods, pre-packaged foods)?",https://www.who.int/emergencies/diseases/novel-coronavirus-2019/question-and-answers-hub/q-a-detail/coronavirus-disease-covid-19-food-safety-for-consumers,who.int,real,100373
,"How to wash fruits and vegetables? Just with water, or something else?",https://www.who.int/emergencies/diseases/novel-coronavirus-2019/question-and-answers-hub/q-a-detail/coronavirus-disease-covid-19-food-safety-for-consumers,who.int,real,100374
,Can the virus live on the surface of food packaging? How long? Is it necessary to disinfect?,https://www.who.int/emergencies/diseases/novel-coronavirus-2019/question-and-answers-hub/q-a-detail/coronavirus-disease-covid-19-food-safety-for-consumers,who.int,real,100375
,How long is it to cook food? To what temperature to kill the virus?,https://www.who.int/emergencies/diseases/novel-coronavirus-2019/question-and-answers-hub/q-a-detail/coronavirus-disease-covid-19-food-safety-for-consumers,who.int,real,100376
,What precautions should consumers take in grocery stores?,https://www.who.int/emergencies/diseases/novel-coronavirus-2019/question-and-answers-hub/q-a-detail/coronavirus-disease-covid-19-food-safety-for-consumers,who.int,real,100377
,Is food/grocery delivery safe?,https://www.who.int/emergencies/diseases/novel-coronavirus-2019/question-and-answers-hub/q-a-detail/coronavirus-disease-covid-19-food-safety-for-consumers,who.int,real,100378
,What is the best household disinfectant for surfaces?,https://www.who.int/emergencies/diseases/novel-coronavirus-2019/question-and-answers-hub/q-a-detail/coronavirus-disease-covid-19-food-safety-for-consumers,who.int,real,100379
,Is it still safe to go to food markets? Animal markets? Wet markets?,https://www.who.int/emergencies/diseases/novel-coronavirus-2019/question-and-answers-hub/q-a-detail/coronavirus-disease-covid-19-food-safety-for-consumers,who.int,real,100380
,Can someone who has tested positive for COVID-19 be cared for at home?,https://www.who.int/emergencies/diseases/novel-coronavirus-2019/question-and-answers-hub/q-a-detail/coronavirus-disease-covid-19-home-care-for-families-and-caregivers,who.int,real,100381
,What should be done to prevent other people in the house from becoming sick if a person with COVID-19 is being cared for at home?,https://www.who.int/emergencies/diseases/novel-coronavirus-2019/question-and-answers-hub/q-a-detail/coronavirus-disease-covid-19-home-care-for-families-and-caregivers,who.int,real,100382
,How long should people with COVID-19 stay at home and in isolation?,https://www.who.int/emergencies/diseases/novel-coronavirus-2019/question-and-answers-hub/q-a-detail/coronavirus-disease-covid-19-home-care-for-families-and-caregivers,who.int,real,100383
,When should a patient with COVID-19 be cared for at home?,https://www.who.int/emergencies/diseases/novel-coronavirus-2019/question-and-answers-hub/q-a-detail/coronavirus-disease-covid-19-home-care-for-health-workers-and-administrators,who.int,real,100384
,What factors determine whether a COVID-19 patient can be cared for at home?,https://www.who.int/emergencies/diseases/novel-coronavirus-2019/question-and-answers-hub/q-a-detail/coronavirus-disease-covid-19-home-care-for-health-workers-and-administrators,who.int,real,100385
,What additional factors should be taken into consideration when assessing the home setting to determine if it is safe for patients and families to remain at home?,https://www.who.int/emergencies/diseases/novel-coronavirus-2019/question-and-answers-hub/q-a-detail/coronavirus-disease-covid-19-home-care-for-health-workers-and-administrators,who.int,real,100386
,What precautions should health workers take when providing care to patients in home settings?,https://www.who.int/emergencies/diseases/novel-coronavirus-2019/question-and-answers-hub/q-a-detail/coronavirus-disease-covid-19-home-care-for-health-workers-and-administrators,who.int,real,100387
,Could pregnant women be cared for at home if they have COVID-19?,https://www.who.int/emergencies/diseases/novel-coronavirus-2019/question-and-answers-hub/q-a-detail/coronavirus-disease-covid-19-home-care-for-health-workers-and-administrators,who.int,real,100388
,Can children be cared for at home if they have COVID-19?,https://www.who.int/emergencies/diseases/novel-coronavirus-2019/question-and-answers-hub/q-a-detail/coronavirus-disease-covid-19-home-care-for-health-workers-and-administrators,who.int,real,100389
,How does COVID-19 spread between people?,https://www.who.int/emergencies/diseases/novel-coronavirus-2019/question-and-answers-hub/q-a-detail/coronavirus-disease-covid-19-how-is-it-transmitted,who.int,real,100390
,When do infected people transmit the virus?,https://www.who.int/emergencies/diseases/novel-coronavirus-2019/question-and-answers-hub/q-a-detail/coronavirus-disease-covid-19-how-is-it-transmitted,who.int,real,100391
,What is the difference between people who are asymptomatic or pre-symptomatic? Don’t they both mean someone without symptoms?,https://www.who.int/emergencies/diseases/novel-coronavirus-2019/question-and-answers-hub/q-a-detail/coronavirus-disease-covid-19-how-is-it-transmitted,who.int,real,100392
,Are there certain settings where COVID-19 can spread more easily?,https://www.who.int/emergencies/diseases/novel-coronavirus-2019/question-and-answers-hub/q-a-detail/coronavirus-disease-covid-19-how-is-it-transmitted,who.int,real,100393
,How can I reduce my risk of getting COVID-19?,https://www.who.int/emergencies/diseases/novel-coronavirus-2019/question-and-answers-hub/q-a-detail/coronavirus-disease-covid-19-how-is-it-transmitted,who.int,real,100394
,How many malaria-affected countries have reported cases of COVID-19?,https://www.who.int/emergencies/diseases/novel-coronavirus-2019/question-and-answers-hub/q-a-detail/coronavirus-disease-covid-19-malaria-and-covid-19,who.int,real,100395
,Should core malaria vector control interventions be maintained in view of the rapid global spread of COVID-19?,https://www.who.int/emergencies/diseases/novel-coronavirus-2019/question-and-answers-hub/q-a-detail/coronavirus-disease-covid-19-malaria-and-covid-20,who.int,real,100396
,Should WHO-recommended preventive therapies be maintained in sub-Saharan Africa?,https://www.who.int/emergencies/diseases/novel-coronavirus-2019/question-and-answers-hub/q-a-detail/coronavirus-disease-covid-19-malaria-and-covid-21,who.int,real,100397
,Are there any changes to WHO guidance with respect to malaria diagnosis and treatment?,https://www.who.int/emergencies/diseases/novel-coronavirus-2019/question-and-answers-hub/q-a-detail/coronavirus-disease-covid-19-malaria-and-covid-22,who.int,real,100398
,What additional special measures may be needed in the context of COVID-19?,https://www.who.int/emergencies/diseases/novel-coronavirus-2019/question-and-answers-hub/q-a-detail/coronavirus-disease-covid-19-malaria-and-covid-23,who.int,real,100399
,What are the key considerations for countries that are working to eliminate malaria or prevent re-establishment of transmission?,https://www.who.int/emergencies/diseases/novel-coronavirus-2019/question-and-answers-hub/q-a-detail/coronavirus-disease-covid-19-malaria-and-covid-24,who.int,real,100400
,Why is WHO particularly concerned about the spread of COVID-19 in malaria-affected areas?,https://www.who.int/emergencies/diseases/novel-coronavirus-2019/question-and-answers-hub/q-a-detail/coronavirus-disease-covid-19-malaria-and-covid-25,who.int,real,100401
,Have there been disruptions in the global supply of key malaria-related commodities as a result of the COVID-19 pandemic?,https://www.who.int/emergencies/diseases/novel-coronavirus-2019/question-and-answers-hub/q-a-detail/coronavirus-disease-covid-19-malaria-and-covid-26,who.int,real,100402
,What is WHO’s position on the use of chloroquine and hydroxychloroquine in the context of the COVID-19 response?,https://www.who.int/emergencies/diseases/novel-coronavirus-2019/question-and-answers-hub/q-a-detail/coronavirus-disease-covid-19-malaria-and-covid-27,who.int,real,100403
,What is WHO’s position on the use of Artemisia plant material for the prevention or treatment of malaria and/or COVID-19?,https://www.who.int/emergencies/diseases/novel-coronavirus-2019/question-and-answers-hub/q-a-detail/coronavirus-disease-covid-19-malaria-and-covid-28,who.int,real,100404
,What is WHO doing to support malaria-affected countries in the context of COVID-19?,https://www.who.int/emergencies/diseases/novel-coronavirus-2019/question-and-answers-hub/q-a-detail/coronavirus-disease-covid-19-malaria-and-covid-29,who.int,real,100405
,"I am ATTENDING a small gathering or an event such as a wedding, a party or sports tournament. What precautions should I take to protect myself and others from getting infected with COVID-19?",https://www.who.int/emergencies/diseases/novel-coronavirus-2019/question-and-answers-hub/q-a-detail/coronavirus-disease-covid-19-small-public-gatherings,who.int,real,100406
,"I am ORGANIZING a small gathering or an event such as a wedding, a party or sports tournament. What precautions should I take to prevent the spread of COVID-19 among guests?",https://www.who.int/emergencies/diseases/novel-coronavirus-2019/question-and-answers-hub/q-a-detail/coronavirus-disease-covid-19-small-public-gatherings,who.int,real,100407
,What precautions should everyone take in a hotel or other accommodation establishment?,https://www.who.int/emergencies/diseases/novel-coronavirus-2019/question-and-answers-hub/q-a-detail/coronavirus-disease-covid-19-staying-at-hotels-and-accommodation-establishments,who.int,real,100408
,Are pools and water areas safe to use?,https://www.who.int/emergencies/diseases/novel-coronavirus-2019/question-and-answers-hub/q-a-detail/coronavirus-disease-covid-19-staying-at-hotels-and-accommodation-establishments,who.int,real,100409
,Are there precautions to take while eating in a restaurant?,https://www.who.int/emergencies/diseases/novel-coronavirus-2019/question-and-answers-hub/q-a-detail/coronavirus-disease-covid-19-staying-at-hotels-and-accommodation-establishments,who.int,real,100410
,Is it safe to use fans or air conditioning in an accommodation?,https://www.who.int/emergencies/diseases/novel-coronavirus-2019/question-and-answers-hub/q-a-detail/coronavirus-disease-covid-19-staying-at-hotels-and-accommodation-establishments,who.int,real,100411
,Can you get the virus from people who were in the room previous to you?,https://www.who.int/emergencies/diseases/novel-coronavirus-2019/question-and-answers-hub/q-a-detail/coronavirus-disease-covid-19-staying-at-hotels-and-accommodation-establishments,who.int,real,100412
,What should travelers do if they get sick while at an accommodation facility?,https://www.who.int/emergencies/diseases/novel-coronavirus-2019/question-and-answers-hub/q-a-detail/coronavirus-disease-covid-19-staying-at-hotels-and-accommodation-establishments,who.int,real,100413
,What precautions should I take during travel?,https://www.who.int/emergencies/diseases/novel-coronavirus-2019/question-and-answers-hub/q-a-detail/coronavirus-disease-covid-19-travel-advice-for-the-general-public,who.int,real,100414
,Who should not travel?,https://www.who.int/emergencies/diseases/novel-coronavirus-2019/question-and-answers-hub/q-a-detail/coronavirus-disease-covid-19-travel-advice-for-the-general-public,who.int,real,100415
,What is meant by “essential travel”?,https://www.who.int/emergencies/diseases/novel-coronavirus-2019/question-and-answers-hub/q-a-detail/coronavirus-disease-covid-19-travel-advice-for-the-general-public,who.int,real,100416
,"If I feel well but am in the high-risk category, should I travel?",https://www.who.int/emergencies/diseases/novel-coronavirus-2019/question-and-answers-hub/q-a-detail/coronavirus-disease-covid-19-travel-advice-for-the-general-public,who.int,real,100417
,How can ventilation reduce the risk of contracting COVID-19 in airplanes?,https://www.who.int/emergencies/diseases/novel-coronavirus-2019/question-and-answers-hub/q-a-detail/coronavirus-disease-covid-19-travel-advice-for-the-general-public,who.int,real,100418
,The travel company is asking me to wear a mask while traveling. Which kind of mask should I use?,https://www.who.int/emergencies/diseases/novel-coronavirus-2019/question-and-answers-hub/q-a-detail/coronavirus-disease-covid-19-travel-advice-for-the-general-public,who.int,real,100419
,Should I get an immunity certificate before travelling?,https://www.who.int/emergencies/diseases/novel-coronavirus-2019/question-and-answers-hub/q-a-detail/coronavirus-disease-covid-19-travel-advice-for-the-general-public,who.int,real,100420
,Could I be screened when I exit or arrive at my destination?,https://www.who.int/emergencies/diseases/novel-coronavirus-2019/question-and-answers-hub/q-a-detail/coronavirus-disease-covid-19-travel-advice-for-the-general-public,who.int,real,100421
,Should I use a digital contact tracing app while traveling?,https://www.who.int/emergencies/diseases/novel-coronavirus-2019/question-and-answers-hub/q-a-detail/coronavirus-disease-covid-19-travel-advice-for-the-general-public,who.int,real,100422
,Should I get a test before departure or upon arrival?,https://www.who.int/emergencies/diseases/novel-coronavirus-2019/question-and-answers-hub/q-a-detail/coronavirus-disease-covid-19-travel-advice-for-the-general-public,who.int,real,100423
,What happens if I have symptoms when arriving at my destination?,https://www.who.int/emergencies/diseases/novel-coronavirus-2019/question-and-answers-hub/q-a-detail/coronavirus-disease-covid-19-travel-advice-for-the-general-public,who.int,real,100424
,What should I do after arriving at my destination?,https://www.who.int/emergencies/diseases/novel-coronavirus-2019/question-and-answers-hub/q-a-detail/coronavirus-disease-covid-19-travel-advice-for-the-general-public,who.int,real,100425
,What should I do if I get sick while traveling?,https://www.who.int/emergencies/diseases/novel-coronavirus-2019/question-and-answers-hub/q-a-detail/coronavirus-disease-covid-19-travel-advice-for-the-general-public,who.int,real,100426
,What is ventilation?,https://www.who.int/emergencies/diseases/novel-coronavirus-2019/question-and-answers-hub/q-a-detail/coronavirus-disease-covid-19-ventilation-and-air-conditioning,who.int,real,100427
,What is WHO doing to address ventilation in the context of COVID-19?,https://www.who.int/emergencies/diseases/novel-coronavirus-2019/question-and-answers-hub/q-a-detail/coronavirus-disease-covid-19-ventilation-and-air-conditioning,who.int,real,100428
,Can I use air conditioning in the context of COVID-19?,https://www.who.int/emergencies/diseases/novel-coronavirus-2019/question-and-answers-hub/q-a-detail/coronavirus-disease-covid-19-ventilation-and-air-conditioning,who.int,real,100429
,Can fans be used safely in indoor spaces?,https://www.who.int/emergencies/diseases/novel-coronavirus-2019/question-and-answers-hub/q-a-detail/coronavirus-disease-covid-19-ventilation-and-air-conditioning,who.int,real,100430
,How can ventilation reduce the risk of contracting COVID-19 in airplanes?,https://www.who.int/emergencies/diseases/novel-coronavirus-2019/question-and-answers-hub/q-a-detail/coronavirus-disease-covid-19-ventilation-and-air-conditioning,who.int,real,100431
,What is WHO doing to address ventilation in the context of COVID-19?,https://www.who.int/emergencies/diseases/novel-coronavirus-2019/question-and-answers-hub/q-a-detail/coronavirus-disease-covid-19-ventilation-and-air-conditioning-in-health-facilities,who.int,real,100432
,What are the recommended air ventilation requirements for health facilities?,https://www.who.int/emergencies/diseases/novel-coronavirus-2019/question-and-answers-hub/q-a-detail/coronavirus-disease-covid-19-ventilation-and-air-conditioning-in-health-facilities,who.int,real,100433
,Can the use of air conditioning increase the risk of SARS-CoV-2 transmission in health facilities?,https://www.who.int/emergencies/diseases/novel-coronavirus-2019/question-and-answers-hub/q-a-detail/coronavirus-disease-covid-19-ventilation-and-air-conditioning-in-health-facilities,who.int,real,100434
,Can fans be used in health facilities?,https://www.who.int/emergencies/diseases/novel-coronavirus-2019/question-and-answers-hub/q-a-detail/coronavirus-disease-covid-19-ventilation-and-air-conditioning-in-health-facilities,who.int,real,100435
,What medical procedures are considered aerosol generating in health facilities?,https://www.who.int/emergencies/diseases/novel-coronavirus-2019/question-and-answers-hub/q-a-detail/coronavirus-disease-covid-19-ventilation-and-air-conditioning-in-health-facilities,who.int,real,100436
,What is ventilation?,https://www.who.int/emergencies/diseases/novel-coronavirus-2019/question-and-answers-hub/q-a-detail/coronavirus-disease-covid-19-ventilation-and-air-conditioning-in-public-spaces-and-buildings,who.int,real,100437
,What is WHO doing to address ventilation in the context of COVID-19?,https://www.who.int/emergencies/diseases/novel-coronavirus-2019/question-and-answers-hub/q-a-detail/coronavirus-disease-covid-19-ventilation-and-air-conditioning-in-public-spaces-and-buildings,who.int,real,100438
,What steps can be undertaken to improve the ventilation in indoor public spaces and buildings?,https://www.who.int/emergencies/diseases/novel-coronavirus-2019/question-and-answers-hub/q-a-detail/coronavirus-disease-covid-19-ventilation-and-air-conditioning-in-public-spaces-and-buildings,who.int,real,100439
,"Are there any recommendations for offices, schools and the accommodation sector regarding ventilation and air conditioning use?",https://www.who.int/emergencies/diseases/novel-coronavirus-2019/question-and-answers-hub/q-a-detail/coronavirus-disease-covid-19-ventilation-and-air-conditioning-in-public-spaces-and-buildings,who.int,real,100440
